{
  "contract_version": "1.0",
  "acceptance_id": "acceptance_phase_01_module_main",
  "task_id": "task_phase_01_module_main",
  "required_tests": [
    "unit",
    "integration"
  ],
  "required_graders": [
    "contract_validator"
  ],
  "required_artifacts": [
    "artifact_phase_01_module_main_result"
  ],
  "hidden_test_group": "core",
  "rollback_on_failure": true,
  "human_review_required": false
}